{
  "id": "0003",
  "seq": 3,
  "chapter": 1,
  "text": "Lantern stranger patience bell net flame workshop riddle shore shingle name ledger keeper salt morning deep letter winter gull watch water tide silver plank song sleep clock market stone key hair harbour river quiet door sun lantern stranger patience bell net flame workshop riddle shore shingle name ledger keeper salt morning deep letter winter gull watch water tide silver plank song sleep clock market stone key hair harbour river quiet door sun lantern stranger patience bell net flame workshop riddle shore shingle name ledger keeper salt morning deep letter winter gull watch water tide silver plank song sleep clock market stone key hair harbour river quiet door sun lantern stranger patience bell net flame workshop riddle shore shingle name ledger keeper salt morning deep letter winter gull watch water tide silver plank song sleep clock market stone key hair harbour river quiet door sun lantern stranger patience bell net flame.\n\nRiver quiet door sun lantern stranger patience bell net flame workshop riddle shore shingle name ledger keeper salt morning deep letter winter gull watch water tide silver plank song sleep clock market stone key hair harbour river quiet door sun lantern stranger patience bell net flame workshop riddle shore shingle name ledger keeper salt morning deep letter winter gull watch water tide silver plank song sleep clock market stone key hair harbour river quiet door sun lantern stranger patience bell net flame workshop riddle shore shingle name ledger keeper salt morning deep letter winter gull watch water tide silver plank song sleep clock market stone key hair harbour river quiet door sun lantern stranger patience bell net flame workshop riddle shore shingle name ledger keeper salt morning deep letter winter gull watch water tide silver plank song sleep clock market stone key hair harbour river quiet door sun lantern stranger.\n\nStone key hair harbour river quiet door sun lantern stranger patience bell net flame workshop riddle shore shingle name ledger keeper salt morning deep letter winter gull watch water tide silver plank song sleep clock market stone key hair harbour river quiet door sun lantern stranger patience bell net flame workshop riddle shore shingle name ledger keeper salt morning deep letter winter gull watch water tide silver plank song sleep clock market stone key hair harbour river quiet door sun lantern stranger patience bell net flame workshop riddle shore shingle name ledger keeper salt morning deep letter winter gull watch water tide silver plank song sleep clock market stone key hair harbour river quiet door sun lantern stranger patience bell net flame workshop riddle shore shingle name ledger keeper salt morning deep letter winter gull watch water tide silver plank song sleep clock market stone key hair harbour river quiet.",
  "word_count": 450
}
