{
  "id": "0004",
  "seq": 4,
  "chapter": 2,
  "text": "River quiet door sun lantern stranger patience bell net flame workshop riddle shore shingle name ledger keeper salt morning deep letter winter gull watch water tide silver plank song sleep clock market stone key hair harbour river quiet door sun lantern stranger patience bell net flame workshop riddle shore shingle name ledger keeper salt morning deep letter winter gull watch water tide silver plank song sleep clock market stone key hair harbour river quiet door sun lantern stranger patience bell net flame workshop riddle shore shingle name ledger keeper salt morning deep letter winter gull watch water tide silver plank song sleep clock market stone key hair harbour river quiet door sun lantern stranger patience bell net flame workshop riddle shore shingle name ledger keeper salt morning deep letter winter gull watch water tide silver plank song sleep clock market stone key hair harbour river quiet door sun lantern stranger.\n\nStone key hair harbour river quiet door sun lantern stranger patience bell net flame workshop riddle shore shingle name ledger keeper salt morning deep letter winter gull watch water tide silver plank song sleep clock market stone key hair harbour river quiet door sun lantern stranger patience bell net flame workshop riddle shore shingle name ledger keeper salt morning deep letter winter gull watch water tide silver plank song sleep clock market stone key hair harbour river quiet door sun lantern stranger patience bell net flame workshop riddle shore shingle name ledger keeper salt morning deep letter winter gull watch water tide silver plank song sleep clock market stone key hair harbour river quiet door sun lantern stranger patience bell net flame workshop riddle shore shingle name ledger keeper salt morning deep letter winter gull watch water tide silver plank song sleep clock market stone key hair harbour river quiet.\n\nSong sleep clock market stone key hair harbour river quiet door sun lantern stranger patience bell net flame workshop riddle shore shingle name ledger keeper salt morning deep letter winter gull watch water tide silver plank song sleep clock market stone key hair harbour river quiet door sun lantern stranger patience bell net flame workshop riddle shore shingle name ledger keeper salt morning deep letter winter gull watch water tide silver plank song sleep clock market stone key hair harbour river quiet door sun lantern stranger patience bell net flame workshop riddle shore shingle name ledger keeper salt morning deep letter winter gull watch water tide silver plank song sleep clock market stone key hair harbour river quiet door sun lantern stranger patience bell net flame workshop riddle shore shingle name ledger keeper salt morning deep letter winter gull watch water tide silver plank song sleep clock market stone key.\n\nWater tide silver plank song sleep clock market stone key hair harbour river quiet door sun lantern stranger patience bell net flame workshop riddle shore shingle name ledger keeper salt morning deep letter winter gull watch water tide silver plank song sleep clock market stone key hair harbour river quiet door sun lantern stranger patience bell net flame workshop riddle shore shingle name ledger keeper salt morning deep letter winter gull watch water tide silver plank song sleep clock market stone key hair harbour river quiet door sun lantern stranger patience bell net flame workshop riddle shore shingle name ledger keeper salt morning deep letter winter gull watch water tide silver plank song sleep clock market stone key hair harbour river quiet door sun lantern stranger patience bell net flame workshop riddle shore shingle name ledger keeper salt morning deep letter winter gull watch water tide silver plank song sleep.",
  "word_count": 600
}
