{
  "id": "0002",
  "seq": 2,
  "chapter": 1,
  "text": "The quiet harbour lay under a cold grey sky as the wanderer walked the length of the stone quay past shuttered stalls and coiled ropes and the salt smell of the turning tide.\n\nThe quiet harbour lay under a cold grey sky as the wanderer walked the length of the stone quay past shuttered stalls and coiled ropes and the salt smell of the turning tide.\n\nThe quiet harbour lay under a cold grey sky as the wanderer walked the length of the stone quay past shuttered stalls and coiled ropes and the salt smell of the turning tide.\n\nThe quiet harbour lay under a cold grey sky as the wanderer walked the length of the stone quay past shuttered stalls and coiled ropes and the salt smell of the turning tide.\n\nThe quiet harbour lay under a cold grey sky as the wanderer walked the length of the stone quay past shuttered stalls and coiled ropes and the salt smell of the turning tide.\n\nThe quiet harbour lay under a cold grey sky as the wanderer walked the length of the stone quay past shuttered stalls and coiled ropes and the salt smell of the turning tide.\n\nThe quiet harbour lay under a cold grey sky as the wanderer walked the length of the stone quay past shuttered stalls and coiled ropes and the salt smell of the turning tide.\n\nThe quiet harbour lay under a cold grey sky as the wanderer walked the length of the stone quay past shuttered stalls and coiled ropes and the salt smell of the turning tide.\n\nThe quiet harbour lay under a cold grey sky as the wanderer walked the length of the stone quay past shuttered stalls and coiled ropes and the salt smell of the turning tide.\n\nThe quiet harbour lay under a cold grey sky as the wanderer walked the length of the stone quay past shuttered stalls and coiled ropes and the salt smell of the turning tide.\n\nThe quiet harbour lay under a cold grey sky as the wanderer walked the length of the stone quay past shuttered stalls and coiled ropes and the salt smell of the turning tide.\n\nThe quiet harbour lay under a cold grey sky as the wanderer walked the length of the stone quay past shuttered stalls and coiled ropes and the salt smell of the turning tide.\n\nThe quiet harbour lay under a cold grey sky as the wanderer walked the length of the stone quay past shuttered stalls and coiled ropes and the salt smell of the turning tide.\n\nThe quiet harbour lay under a cold grey sky as the wanderer walked the length of the stone quay past shuttered stalls and coiled ropes and the salt smell of the turning tide.\n\nThe quiet harbour lay under a cold grey sky as the wanderer walked the length of the stone quay past shuttered stalls and coiled ropes and the salt smell of the turning tide.\n\nThe quiet harbour lay under a cold grey sky as the wanderer walked the length of the stone quay past shuttered stalls and coiled ropes and the salt smell of the turning tide.\n\nThe quiet harbour lay under a cold grey sky as the wanderer walked the length of the stone quay past shuttered stalls and coiled ropes and the salt smell of the turning tide.",
  "word_count": 561,
  "ledger": {
    "location": "the stone quay",
    "time_of_day": "day",
    "atmosphere": "cold, grey",
    "present": [
      "the Wanderer"
    ],
    "scene_changed": true,
    "visual_salience": 0.5,
    "best_visual_beat": "a lone figure on the empty quay",
    "carry_notes": ""
  }
}
