{
  "id": "0005",
  "seq": 5,
  "chapter": 2,
  "text": "Letter winter gull watch water tide silver plank song sleep clock market stone key hair harbour river quiet door sun lantern stranger patience bell net flame workshop riddle shore shingle name ledger keeper salt morning deep letter winter gull watch water tide silver plank song sleep clock market stone key hair harbour river quiet door sun lantern stranger patience bell net flame workshop riddle shore shingle name ledger keeper salt morning deep letter winter gull watch water tide silver plank song sleep clock market stone key hair harbour river quiet door sun lantern stranger patience bell net flame workshop riddle shore shingle name ledger keeper salt morning deep letter winter gull watch water tide silver plank song sleep clock market stone key hair harbour river quiet door sun lantern stranger patience bell net flame workshop riddle shore shingle name ledger keeper salt morning deep letter winter gull watch water tide.\n\nKeeper salt morning deep letter winter gull watch water tide silver plank song sleep clock market stone key hair harbour river quiet door sun lantern stranger patience bell net flame workshop riddle shore shingle name ledger keeper salt morning deep letter winter gull watch water tide silver plank song sleep clock market stone key hair harbour river quiet door sun lantern stranger patience bell net flame workshop riddle shore shingle name ledger keeper salt morning deep letter winter gull watch water tide silver plank song sleep clock market stone key hair harbour river quiet door sun lantern stranger patience bell net flame workshop riddle shore shingle name ledger keeper salt morning deep letter winter gull watch water tide silver plank song sleep clock market stone key hair harbour river quiet door sun lantern stranger patience bell net flame workshop riddle shore shingle name ledger keeper salt morning deep letter winter.\n\nShore shingle name ledger keeper salt morning deep letter winter gull watch water tide silver plank song sleep clock market stone key hair harbour river quiet door sun lantern stranger patience bell net flame workshop riddle shore shingle name ledger keeper salt morning deep letter winter gull watch water tide silver plank song sleep clock market stone key hair harbour river quiet door sun lantern stranger patience bell net flame workshop riddle shore shingle name ledger keeper salt morning deep letter winter gull watch water tide silver plank song sleep clock market stone key hair harbour river quiet door sun lantern stranger patience bell net flame workshop riddle shore shingle name ledger keeper salt morning deep letter winter gull watch water tide silver plank song sleep clock market stone key hair harbour river quiet door sun lantern stranger patience bell net flame workshop riddle shore shingle name ledger keeper salt.\n\nNet flame workshop riddle shore shingle name ledger keeper salt morning deep letter winter gull watch water tide silver plank song sleep clock market stone key hair harbour river quiet door sun lantern stranger patience bell net flame workshop riddle shore shingle name ledger keeper salt morning deep letter winter gull watch water tide silver plank song sleep clock market stone key hair harbour river quiet door sun lantern stranger patience bell net flame workshop riddle shore shingle name ledger keeper salt morning deep letter winter gull watch water tide silver plank song sleep clock market stone key hair harbour river quiet door sun lantern stranger patience bell net flame workshop riddle shore shingle name ledger keeper salt morning deep letter winter gull watch water tide silver plank song sleep clock market stone key hair harbour river quiet door sun lantern stranger patience bell net flame workshop riddle shore shingle.",
  "word_count": 600
}
